Name,YC Page,Batch,Industry,Description,Website,Founding Year,Headquarters,Founders,Founders_LinkedIn,Founders_Twitter
Autonomous Technologies Group,https://www.ycombinator.com/companies/autonomous-technologies-group,Fall 2025,Fintech,"Superintelligent financial advisor. Founded in 2025 by Dillon Erb and Daniel Kobran, Autonomous Technologies Group has 8 employees based in New York, NY, USA. Autonomous Technologies Group is hiring for 8 roles in design, operations, and engineering.",https://becomeautonomous.com,2025,"New York, NY, USA",Dillon Erb; Daniel Kobran,https://www.linkedin.com/in/dillonerb; https://www.linkedin.com/in/daniel-kobran/,https://twitter.com/dlnrb; 
Fifth Door,https://www.ycombinator.com/companies/fifth-door,Fall 2025,Consumer; Gaming,"Create and play games with AI. Founded in 2025 by Amir Ghazvinian and Daniel Kan, Fifth Door has 3 employees based in San Francisco, CA, USA. Fifth Door is hiring for 1 roles in engineering.",https://fifthdoor.com,2025,"San Francisco, CA, USA",Amir Ghazvinian; Daniel Kan,https://www.linkedin.com/in/amirghazvinian/; https://www.linkedin.com/in/danielkan,; 
Piggy Robotics,https://www.ycombinator.com/companies/piggy-robotics,Fall 2025,Industrials; Manufacturing and Robotics,"Humanoid robots that do your chores for the price of an iPhone!. Founded in 2024 by Chenny (Qianyi) Deng and Richard Gong, Piggy Robotics has 15 employees based in .",https://piggyrobotics.com,2024,,Richard Gong; Chenny (Qianyi) Deng; Team,https://www.linkedin.com/in/richard-g-15852b22b/; https://www.linkedin.com/in/qianyi-deng/; https://www.linkedin.com/in/richard-g-15852b22b,; https://x.com/Chenny_Deng33; 
Goldbridge,https://www.ycombinator.com/companies/goldbridge,Fall 2025,Real Estate and Construction; Housing and Real Estate,"Ramp for Real Estate. Founded in 2025 by Greg Rami and Alvin Salehi, Goldbridge has 3 employees based in .",https://www.goldbridgebanking.com,2025,,Alvin Salehi; Greg Rami; THE PROBLEM,https://linkedin.com/in/alvandsalehi; https://linkedin.com/in/gregrami; https://www.linkedin.com/in/alvinsalehi/,https://x.com/alvinsalehi_; ; 
Sylvian,https://www.ycombinator.com/companies/sylvian,Fall 2025,B2B,"Specialized AI Agents. Founded in 2025 by , Sylvian has 2 employees based in San Francisco, CA, USA.",https://sylvian.ai,2025,"San Francisco, CA, USA",William Huang; Niall Kehoe; Problem,https://www.linkedin.com/in/william-s-huang/; https://www.linkedin.com/in/niallkehoe; https://linkedin.com/in/william-s-huang,https://x.com/amiwilliamhuang; ; 
