Name,YC Page,Batch,Industry,Description,Website,Founding Year,Headquarters,Founders,Founders_LinkedIn,Founders_Twitter
DreamRP,https://www.ycombinator.com/companies/dreamrp,Summer 2024,Consumer,"Tech and platforms for human creators and the entertainment industry. Founded in 2024 by Phillip Huang, DreamRP has 2 employees based in San Francisco, CA, USA.",https://www.dreamrp.com,2024,"San Francisco, CA, USA",Phillip Huang; Enter DreamRP,https://linkedin.com/in/philliphuang; https://linkedin.com/in/philliphuang,; https://x.com/Yuumei_Art/status/1813861897198096886
SimCare,https://www.ycombinator.com/companies/simcare,Summer 2024,Healthcare,"AI avatars to scale healthcare training. Founded in 2024 by Tiko Bdoyan and Vrishank Saini, SimCare has 7 employees based in San Francisco, CA, USA. SimCare is hiring for 1 roles in operations.",https://simcare.ai,2024,"San Francisco, CA, USA",Vrishank Saini; Tiko Bdoyan; The Team,https://www.linkedin.com/in/vrishanksaini/; https://www.linkedin.com/in/tigran-bdoyan/details/experience/; https://www.linkedin.com/in/vrishanksaini/,; ; 
Arva AI,https://www.ycombinator.com/companies/arva-ai,Summer 2024,B2B,"AI Agents to scale AML, KYB and KYC operations. Founded in 2024 by Rhim Shah and Oli Wales, Arva AI has 14 employees based in . Arva AI is hiring for 7 roles in sales, product, and engineering.",https://www.arva.ai,2024,,Rhim Shah; Oli Wales; ❌ The Problem,https://linkedin.com/in/rhim-shah; https://linkedin.com/in/oliverfwales; https://www.linkedin.com/in/rhim-shah/,; ; 
Capitol AI,https://www.ycombinator.com/companies/capitol-ai,Summer 2024,B2B; Productivity,"Capitol: the sovereign operating system for intelligence. Founded in 2021 by thomas hallaran and Shaun Modi, Capitol AI has 11 employees based in Washington, DC, USA. Capitol AI is hiring for 2 roles in engineering.",https://www.capitol.ai,2021,"Washington, DC, USA",Shaun Modi; Founder; The Business Problem,https://www.linkedin.com/in/shaunmodi/; https://www.linkedin.com/in/tomhallaran/; https://www.linkedin.com/in/shaunmodi/,https://twitter.com/shaunmodi; ; https://x.com/usecapitol
Void,https://www.ycombinator.com/companies/void,Summer 2024,"B2B; Engineering, Product and Design","The open source Cursor alternative. Founded in 2024 by Andrew Pareles and Mathew Pareles, Void has 2 employees based in San Francisco, CA, USA.",https://useglass.ai,2024,"San Francisco, CA, USA",Andrew Pareles; Mathew Pareles; 🙏 Asks,https://linkedin.com/in/andrew-pareles; https://linkedin.com/in/mathew-pareles/; https://linkedin.com/in/mathew-pareles/,https://x.com/andrew_pareles; ; 
Henry,https://www.ycombinator.com/companies/henry-2,Summer 2024,Real Estate and Construction,"Automating Deal Decks for Commercial Real Estate Brokers. Founded in 2024 by Sammy Greenwall and Adam Pratt, Henry has 20 employees based in New York, NY, USA.",http://www.henry.ai,2024,"New York, NY, USA",Sammy Greenwall; Adam Pratt; Company Launches,https://www.linkedin.com/in/sammy-greenwall-387b3256/; https://www.linkedin.com/in/adam-pratt-73a4aa103/; https://www.linkedin.com/in/sammy-greenwall-387b3256/,; ; 
RowBoat Labs,https://www.ycombinator.com/companies/rowboat-labs,Summer 2024,"B2B; Engineering, Product and Design","Open-source AI-assisted agent builder. Founded in 2024 by Arjun Maheswaran and Ramnique Singh, RowBoat Labs has 3 employees based in San Francisco, CA, USA.",https://www.rowboatlabs.com,2024,"San Francisco, CA, USA",Arjun Maheswaran; Ramnique Singh; Problem,https://linkedin.com/in/arjunmaheswaran; https://www.linkedin.com/in/ramnique; https://linkedin.com/in/arjunmaheswaran,https://twitter.com/segmenta; ; 
Pipeshift,https://www.ycombinator.com/companies/pipeshift,Summer 2024,B2B; Infrastructure,"Inference for real-time production workloads. Founded in 2024 by Arko C, Enrique Ferrao, and Pranav Reddy, Pipeshift has 10 employees based in San Francisco, CA, USA.",https://pipeshift.com,2024,"San Francisco, CA, USA",Arko C; Enrique Ferrao; Pranav Reddy,https://linkedin.com/in/arkoc; https://linkedin.com/in/enrique-ferrao; https://linkedin.com/in/pranavreddyg,; https://x.com/FerraoEnrique; https://x.com/pranavreddyg
Terra,https://www.ycombinator.com/companies/terra-2,Summer 2024,B2B; Supply Chain and Logistics,"Design and sell products in minutes. Founded in 2024 by Lev Glushkovskii and Dylan McFarland, Terra has 6 employees based in . Terra is hiring for 1 roles in engineering.",https://useterra.com,2024,,Lev Glushkovskii; Dylan McFarland; —,https://www.linkedin.com/in/lev-glushkovskii/; https://www.linkedin.com/in/dylan-mcfarland/; https://www.linkedin.com/in/dylan-mcfarland/,; ; 
"Diode Computers, Inc.",https://www.ycombinator.com/companies/diode-computers-inc,Summer 2024,"B2B; Engineering, Product and Design","Automate circuit board design using AI. Founded in 2024 by Davide Asnaghi and Lenny Khazan, Diode Computers, Inc. has 3 employees based in New York, NY, USA. Diode Computers, Inc. is hiring for 2 roles in engineering.",https://diode.computer,2024,"New York, NY, USA",Davide Asnaghi; Lenny Khazan; Problem,https://linkedin.com/in/d-asnaghi; https://www.linkedin.com/in/lennykhazan; https://www.linkedin.com/in/lennykhazan/,https://x.com/davideasnaghi; https://twitter.com/LennyKhazan; https://x.com/davideasnaghi
Bucket Robotics,https://www.ycombinator.com/companies/bucket-robotics,Summer 2024,Industrials; Manufacturing and Robotics,"Defect detection for manufacturing built from CAD and synthetic data. Founded in 2024 by Matt Puchalski, Bucket Robotics has 5 employees based in . Bucket Robotics is hiring for 2 roles in engineering.",https://bucket.bot,2024,,Matt Puchalski; 👥 The Team,https://www.linkedin.com/in/matt-puchalski/; https://www.linkedin.com/in/matt-puchalski/,https://x.com/lasermatts; 
Elayne,https://www.ycombinator.com/companies/elayne,Summer 2024,Fintech,"AI copilot for growing, organizing, and transferring family estates. Founded in 2024 by Adria Ferrier and Rebecca Lee, Elayne has 6 employees based in New York, NY, USA.",https://www.elayne.com,2024,"New York, NY, USA",Adria Ferrier; Rebecca Lee; 👫 The Team,https://www.linkedin.com/in/adria-ferrier-8b242836/; https://www.linkedin.com/in/rebeccablee1; https://www.linkedin.com/in/adria-ferrier-8b242836/,; https://twitter.com/beccablee; 
Blaze,https://www.ycombinator.com/companies/blaze-2,Summer 2024,Fintech; Payments,"Global Venmo for cross border payments. Founded in 2023 by Faiyam Rahman and Luc Succès, Blaze has 5 employees based in Mexico City, CDMX, Mexico. Blaze is hiring for 3 roles in engineering and marketing.",https://blaze.money,2023,"Mexico City, CDMX, Mexico",Faiyam Rahman; Luc Succès; 📱 App Preview,https://linkedin.com/in/faiyam-rahman; https://www.linkedin.com/in/lucsucces; https://www.linkedin.com/in/lucsucces,https://x.com/faiyamrahman?s=21; https://x.com/lucsucces; 
pap!,https://www.ycombinator.com/companies/pap,Summer 2024,Consumer,"Agents that earn consumers dollars when they shop, travel, and live. Founded in 2024 by Kamal Nahas, Anthony Rassi, and Weijie Wang, pap! has 3 employees based in Berkeley, CA, USA.",https://joinpap.com,2024,"Berkeley, CA, USA",Kamal Nahas; Anthony Rassi; Weijie Wang; The Problem 🚩,https://www.linkedin.com/in/kamal-nahas/; https://www.linkedin.com/in/anthonyrassi; https://www.linkedin.com/in/wjwang2/; https://www.linkedin.com/in/wjwang2/,; https://x.com/anthonyrassi_; ; 
TradeFlow,https://www.ycombinator.com/companies/tradeflow,Summer 2024,Fintech,"AI-powered settlement for financial securities. Founded in 2024 by Liam Breen and Taryn Reardon, TradeFlow has 2 employees based in New York, NY, USA.",https://www.tradeflowai.com,2024,"New York, NY, USA",Taryn Reardon; Liam Breen; About Us,https://www.linkedin.com/in/taryn-reardon/; https://www.linkedin.com/in/liam-b-456081124/; https://www.linkedin.com/in/taryn-reardon/,; ; 
Quetzal,https://www.ycombinator.com/companies/quetzal,Summer 2024,"B2B; Engineering, Product and Design","Simple, LLM-first translation and internationalization for software. Founded in 2024 by Brendan Agliardo and John Thompson, Quetzal has 2 employees based in Oakland, CA, USA.",https://getquetzal.com,2024,"Oakland, CA, USA",John Thompson,https://linkedin.com/in/jthompson4004,
Typa,https://www.ycombinator.com/companies/typa,Summer 2024,B2B; Marketing,"The content engine that wins attention and drives growth. Founded in 2023 by Andrew Chung and Junyoung Park, Typa has 2 employees based in San Francisco, CA, USA.",https://typa.ai,2023,"San Francisco, CA, USA",Andrew Chung; Junyoung Park; 🔒 Problem,https://linkedin.com/in/aschung01; https://www.linkedin.com/in/jun-park314/; https://www.linkedin.com/in/jun-park314/,https://twitter.com/aschung01; ; https://x.com/weaveldotai
"Sterling Labs, Inc",https://www.ycombinator.com/companies/sterling-labs-inc,Summer 2024,Consumer; Content,"Currently in stealth - previously FocusBuddy. Founded in 2024 by Yash Ramchandani and Adnan Sherif, Sterling Labs, Inc has 2 employees based in San Francisco, CA, USA.",https://www.focusbuddy.ai,2024,"San Francisco, CA, USA",Adnan Sherif; Yash Ramchandani; TLDR,https://www.linkedin.com/in/adnan-sherif-as/; https://www.linkedin.com/in/yashmr/; https://www.linkedin.com/in/adnan-sherif-as/,; https://twitter.com/yash14700/; 
Orca Launcher,https://www.ycombinator.com/companies/orca-launcher,Summer 2024,Consumer,"A launcher that turns Minecraft into a game platform like Roblox . Founded in 2024 by Ege Kaan Duman and Ali Kavoosi, Orca Launcher has 2 employees based in San Francisco, CA, USA.",https://orcalauncher.com,2024,"San Francisco, CA, USA",Ege Kaan Duman; Ali Kavoosi; Raveen Kariyawasam; Team,https://www.linkedin.com/in/ege-kaan-duman-445731173/; https://www.linkedin.com/in/alikav/; https://linkedin.com/in/raveen-kariyawasam-84b368295; https://www.linkedin.com/in/raveen-kariyawasam-84b368295/,https://x.com/egekduman; ; ; 
autarc,https://www.ycombinator.com/companies/autarc,Summer 2024,B2B,"autarc is the OS for Europe's One-Stop Energy Installers. Founded in 2023 by Thies Hansen, Etienne-Noel Krause, and Marius Seufzer, autarc has 30 employees based in Berlin, Germany. autarc is hiring for 1 roles in sales.",https://www.autarc.energy/en,2023,"Berlin, Germany",Etienne-Noel Krause; Thies Hansen; Marius Seufzer; Marius; Thies; Etienne,https://linkedin.com/in/etienne-krause; https://linkedin.com/in/thies-hansen; https://www.linkedin.com/in/marius-seufzer; https://www.linkedin.com/in/marius-seufzer; https://linkedin.com/in/thies-hansen; https://linkedin.com/in/etienne-krause,; ; ; ; ; 
omnidock,https://www.ycombinator.com/companies/omnidock,Summer 2024,B2B; Operations,"OS for global e-commerce expansion of brands & manufacturers. Founded in 2024 by Sebastian Rödling and Shayan Zakerzadeh, omnidock has 1 employees based in .",https://www.omnidock.com,2024,,Shayan Zakerzadeh; Sebastian Rödling; Solution🚀,https://linkedin.com/in/shayan-zakerzadeh; https://www.linkedin.com/in/SebRoe; https://linkedin.com/in/shayan-zakerzadeh,; ; 
Polymet,https://www.ycombinator.com/companies/polymet,Summer 2024,"B2B; Engineering, Product and Design","AI Product Designer. Founded in 2024 by Yusuf Hilmi, Polymet has 3 employees based in .",https://polymet.ai,2024,,Yusuf Hilmi,https://linkedin.com/in/yusufhilmi,https://twitter.com/yusufhilmi_
Entropy,https://www.ycombinator.com/companies/entropy,Summer 2024,Healthcare,"Autonomous intake and RCM for specialty clinics. . Founded in 2024 by Rabii Malik, Entropy has 2 employees based in San Francisco, CA, USA.",https://www.withentropy.ai,2024,"San Francisco, CA, USA",Rabii Malik,https://linkedin.com/in/rabii-malik,https://x.com/TheRabiiMalik
Vendra,https://www.ycombinator.com/companies/vendra,Summer 2024,Industrials,"Custom Parts, Manufactured in America 🇺🇸. Founded in 2024 by Anish Bhardwaj and Shan Mohta, Vendra has 5 employees based in San Francisco, CA, USA. Vendra is hiring for 5 roles in marketing, sales, operations, and engineering.",https://vendra-marketplace.io,2024,"San Francisco, CA, USA",Shan Mohta; Anish Bhardwaj; THE PROBLEM,https://www.linkedin.com/in/shanmohta/; https://www.linkedin.com/in/anish-b-00109695/; https://www.linkedin.com/in/anish-bhardwaj-00109695/,https://x.com/shanmohta; ; https://x.com/vendraHQ
bluedoor,https://www.ycombinator.com/companies/bluedoor,Summer 2024,Fintech; Consumer Finance,"Professional-grade stock research in your terminal. Founded in 2024 by Sam Crombie, bluedoor has 1 employees based in Seattle, WA, USA.",https://bluedoor.sh,2024,"Seattle, WA, USA",Sam Crombie; Solution: Web Action SDK,https://linkedin.com/in/samcrombie; https://linkedin.com/in/samcrombie,https://twitter.com/SamuelCrombie; 
Starcloud,https://www.ycombinator.com/companies/starcloud,Summer 2024,Industrials; Aviation and Space,"Data centers in space. Founded in 2024 by Ezra Feilden, Philip Johnston, and Adi Oltean, Starcloud has 12 employees based in Redmond, WA, USA.",https://www.starcloud.com,2024,"Redmond, WA, USA",Philip Johnston; Ezra Feilden; Adi Oltean; ❌The Problem,https://linkedin.com/in/philipjohnst0n; https://linkedin.com/in/ezrafeilden; https://www.linkedin.com/in/adioltean/; https://www.linkedin.com/in/johnstonphilip/,https://x.com/philipjohnston; ; ; 
Helium,https://www.ycombinator.com/companies/helium,Summer 2024,"B2B; Engineering, Product and Design","Self Improving Software. Founded in 2024 by Shishir Jakati and Zach Witzel, Helium has 7 employees based in San Francisco, CA, USA. Helium is hiring for 6 roles in marketing and engineering.",https://tryhelium.com,2024,"San Francisco, CA, USA",Zach Witzel; Shishir Jakati; .,https://linkedin.com/in/zachwitzel; https://linkedin.com/in/shishirjakati; https://linkedin.com/in/zachwitzel,; https://twitter.com/aShishirJakati; 
Sonatoria,https://www.ycombinator.com/companies/sonatoria,Summer 2024,B2B,"Helping Startups Grow Organically. Founded in 2024 by Jacob Tucker, Sonatoria has 2 employees based in . Sonatoria is hiring for 1 roles in marketing.",https://sonatoria.com,2024,,Jacob Tucker,https://linkedin.com/in/jacobtucker,
Lilac Labs,https://www.ycombinator.com/companies/lilac-labs,Summer 2024,B2B,"We automate the person taking orders at drive-thrus with a voice AI. Founded in 2024 by Tony Kam and Shelden Shi, Lilac Labs has 4 employees based in .",https://www.drive-thru.ai,2024,,Tony Kam; Shelden Shi; Company Launches,https://linkedin.com/in/tonyshekkam; https://linkedin.com/in/sheldenshi; https://linkedin.com/in/tonyshekkam,https://twitter.com/kamikariat; ; 
Palmier,https://www.ycombinator.com/companies/palmier,Summer 2024,Consumer; Content,"Cinematic AI Marketing Videos. Founded in 2024 by Marcos Rico Peng and Harrison Tin, Palmier has 2 employees based in San Francisco, CA, USA.",https://www.palmier.io,2024,"San Francisco, CA, USA",Marcos Rico Peng; Harrison Tin; 🔒 Problem,https://www.linkedin.com/in/marcosrico; https://www.linkedin.com/in/harrison-tin-a260321b3/; https://www.linkedin.com/in/marcosrico,; ; 
Sensei,https://www.ycombinator.com/companies/sensei,Summer 2024,Industrials; Manufacturing and Robotics,"Robotic Training Data at Scale. Founded in 2024 by Anubhav Guha and John Piotti, Sensei has 2 employees based in San Francisco, CA, USA.",https://senseirobotics.com,2024,"San Francisco, CA, USA",Anubhav Guha; John Piotti; Our Team,https://www.linkedin.com/in/anubhav-guha-886445129/; https://www.linkedin.com/in/john-piotti-51a67412a/; https://www.linkedin.com/in/john-piotti-51a67412a/,; ; 
Cerulion,https://www.ycombinator.com/companies/cerulion,Summer 2024,"B2B; Engineering, Product and Design","Open source operating system for robots. Founded in 2024 by Lakshay Sharma, Cerulion has 2 employees based in . Cerulion is hiring for 1 roles in engineering.",https://www.cerulion.com,2024,,Lakshay Sharma; The Problem,https://www.linkedin.com/in/lakshay2010sharma/; https://www.linkedin.com/in/lakshay2010sharma/,https://x.com/_lakshays_; 
The Forecasting Company,https://www.ycombinator.com/companies/the-forecasting-company,Summer 2024,B2B,"Foundation models for time series. Founded in 2024 by Joachim Fainberg and Geoffrey Negiar, The Forecasting Company has 7 employees based in Paris, France. The Forecasting Company is hiring for 1 roles in engineering.",https://www.theforecastingcompany.com,2024,"Paris, France",Geoffrey Negiar; Joachim Fainberg,https://linkedin.com/in/geoffrey-negiar; https://linkedin.com/in/jfainberg,https://twitter.com/geoffnegiar; 
Soff,https://www.ycombinator.com/companies/soff,Summer 2024,B2B; Supply Chain and Logistics,"AI Agents for Distributors. Founded in 2024 by Berni Hausleitner, Soff has 6 employees based in San Francisco, CA, USA. Soff is hiring for 9 roles in operations, product, engineering, and sales.",https://soff.ai,2024,"San Francisco, CA, USA",Berni Hausleitner,https://www.linkedin.com/in/hausleitnerb/,https://x.com/BernhardHausle1
Pinnacle,https://www.ycombinator.com/companies/pinnacle,Summer 2024,"B2B; Engineering, Product and Design","API & SDK for RCS (the next-generation of texting). Founded in 2024 by Sean Roades and Ivan Zhang, Pinnacle has 2 employees based in San Francisco, CA, USA.",https://pinnacle.sh,2024,"San Francisco, CA, USA",Sean Roades; Ivan Zhang; Company Launches,https://www.linkedin.com/in/sr19943/; https://www.linkedin.com/in/aivanzhang/; https://www.linkedin.com/in/seanroades/,https://twitter.com/SeanRoades; https://twitter.com/aivanzhang; 
Ember Robotics,https://www.ycombinator.com/companies/ember-robotics,Summer 2024,Industrials; Manufacturing and Robotics,"Datadog for robots. Founded in 2024 by Shivani Mouleeswaran and Ritika Shrivastava, Ember Robotics has 2 employees based in San Francisco, CA, USA.",https://www.emberrobotics.com,2024,"San Francisco, CA, USA",Shivani Mouleeswaran; Ritika Shrivastava,https://www.linkedin.com/in/shivanicm; https://www.linkedin.com/in/ritikashrivastava/,; 
Emergent,https://www.ycombinator.com/companies/emergent,Summer 2024,Consumer,"AI app builder that turns your ideas into monetizable software. Founded in 2024 by Madhav Jha and Mukund Jha, Emergent has  employees based in San Francisco, CA, USA. Emergent is hiring for 23 roles in operations, support, design, engineering, sales, product, and marketing.",https://emergent.sh,2024,"San Francisco, CA, USA",Mukund Jha; Madhav Jha,https://www.linkedin.com/in/mukund-jha-a1596413/; https://www.linkedin.com/in/madhavjha,https://twitter.com/mukundjha; https://twitter.com/madhavjha
Zeit AI,https://www.ycombinator.com/companies/zeit-ai,Summer 2024,B2B; Analytics,"From data to enterprise insights in just a few words. Founded in 2024 by Marvin Christopher Bornstein and Leopold von Waldthausen, Zeit AI has 6 employees based in . Zeit AI is hiring for 2 roles in engineering.",https://zeit-ai.com,2024,,Founder; Marvin Christopher Bornstein; 🏆 TLDR,https://www.linkedin.com/in/v-waldthausen/; https://www.linkedin.com/in/mcbornstein/; https://www.linkedin.com/in/mcbornstein/,; ; 
Stempad,https://www.ycombinator.com/companies/stempad,Summer 2024,B2B; Productivity,"Notion for science. Founded in 2024 by Ralph Rouhana, Stempad has 1 employees based in .",https://www.stempad.com,2024,,Ralph Rouhana; The Problem,https://www.linkedin.com/in/ralph-rouhana; https://www.linkedin.com/in/ralph-rouhana,; 
Pax,https://www.ycombinator.com/companies/pax,Summer 2024,B2B; Supply Chain and Logistics,"AI Broker for Tariff Refunds. Founded in 2024 by Penny Chen and Chris Le, Pax has 6 employees based in San Francisco, CA, USA. Pax is hiring for 1 roles in engineering.",https://paxai.com,2024,"San Francisco, CA, USA",Penny Chen; Chris Le; Problem,https://www.linkedin.com/in/pennypinyichen/; https://linkedin.com/in/ctle; https://www.linkedin.com/in/pennypinyichen/,; https://x.com/chriiisle; 
winfunc,https://www.ycombinator.com/companies/winfunc,Summer 2024,B2B; Security,"ai-native security engineering for mission critical codebases. Founded in 2024 by Vivek R and Mufeed VH, winfunc has 2 employees based in .",https://winfunc.com,2024,,Mufeed VH; Vivek R; The Problem,https://www.linkedin.com/in/mufeed-vh/; https://www.linkedin.com/in/123vivekr; https://www.linkedin.com/in/mufeed-vh/,https://twitter.com/mufeedvh; https://twitter.com/veev3x; 
Biocartesian,https://www.ycombinator.com/companies/biocartesian,Summer 2024,Healthcare; Drug Discovery and Delivery,"Converting biology into digital molecular maps. Founded in 2023 by Ian Dardani and Jess Li, Biocartesian has 2 employees based in San Francisco, CA, USA.",https://www.biocartesian.com,2023,"San Francisco, CA, USA",Ian Dardani; Jess Li; 👩‍🔬 Team,https://linkedin.com/in/ian-dardani; https://www.linkedin.com/in/jessxli/; https://www.linkedin.com/in/ian-dardani,; ; 
Dimely,https://www.ycombinator.com/companies/dimely,Summer 2024,B2B; Finance and Accounting,"AI-Powered Spreadsheet for Billing Automation. Founded in 2024 by David Pang and Peter Sun, Dimely has 3 employees based in . Dimely is hiring for 1 roles in engineering.",https://dimely.com,2024,,David Pang; Peter Sun,https://linkedin.com/in/davidnpang; https://linkedin.com/in/p2sun,; 
Redouble AI,https://www.ycombinator.com/companies/redouble-ai,Summer 2024,B2B,"Scale human-in-the-loop for AI workflows in regulated industries. Founded in 2024 by Martin Bittner, Haotian Li, and Andrey Santrosyan, Redouble AI has 3 employees based in San Francisco, CA, USA.",https://redouble.ai,2024,"San Francisco, CA, USA",Martin Bittner; Haotian Li; Andrey Santrosyan; The Problem,https://www.linkedin.com/in/martinimmanuelbittner/; https://linkedin.com/in/haotian-li-ba327850; https://linkedin.com/in/santrosyan; https://www.linkedin.com/in/martinimmanuelbittner/,; https://twitter.com/pneumaticdill?s=21; ; 
"Hestus, Inc.",https://www.ycombinator.com/companies/hestus-inc,Summer 2024,"B2B; Engineering, Product and Design","An AI-powered CAD software. Founded in 2024 by Kevin Chu and Sohrab Haghighat, Hestus, Inc. has 3 employees based in . Hestus, Inc. is hiring for 2 roles in engineering.",https://www.hestus.co,2024,,Sohrab Haghighat; Kevin Chu; Hi YC!,https://www.linkedin.com/in/sohrabhaghighat/; https://linkedin.com/in/kevin-chu-11a4511; https://www.linkedin.com/in/kevin-chu-11a4511/,; ; 
FINNY AI,https://www.ycombinator.com/companies/finny-ai,Summer 2024,Fintech; Asset Management,"The organic growth engine for financial advisors . Founded in 2024 by Theodore Janson, Eden Ovadia, and Victoria Toli, FINNY AI has 28 employees based in New York, NY, USA. FINNY AI is hiring for 2 roles in engineering.",https://www.finny.com,2024,"New York, NY, USA",Eden Ovadia; Theodore Janson; Victoria Toli; 🧑‍🔬 The Team,https://linkedin.com/in/edenovadia; https://linkedin.com/in/theodore-janson; https://www.linkedin.com/in/victoria-toli/; https://www.linkedin.com/in/edenovadia/,; ; ; 
1849 bio,https://www.ycombinator.com/companies/1849-bio,Summer 2024,Industrials,"Engineering microbes for miners to unlock billions in trapped metal. Founded in 2024 by Jai Padmakumar and Yongjin Park, 1849 bio has 3 employees based in San Francisco, CA, USA.",https://www.1849.bio,2024,"San Francisco, CA, USA",Jai Padmakumar; Yongjin Park; —,https://linkedin.com/in/jai-padmakumar; https://www.linkedin.com/in/yongjin-park-6604092a/; https://www.linkedin.com/in/yongjin-park-6604092a/,; ; 
Saturn,https://www.ycombinator.com/companies/saturn,Summer 2024,Fintech,"Compliance and back office workflows for Wealth Managers. Founded in 2023 by Michael Ettlinger, Amal Jolly, and Rohit Vaish, Saturn has 18 employees based in London, UK. Saturn is hiring for 7 roles in engineering, product, operations, and marketing.",https://www.SaturnOS.com,2023,"London, UK",Amal Jolly; Michael Ettlinger; Rohit Vaish; —,https://linkedin.com/in/amaljolly; https://www.linkedin.com/in/michaelettlinger/; https://www.linkedin.com/in/rohit-vaish/; https://www.linkedin.com/in/michaelettlinger/,https://twitter.com/theamaljolly; https://twitter.com/etticat; ; 
Promi,https://www.ycombinator.com/companies/promi,Summer 2024,B2B; Retail,"Optimizing ecommerce pricing with dynamic, personalized discounts. Founded in 2024 by Jiaxin Lin and Peter Moot, Promi has 2 employees based in .",https://www.usepromi.com,2024,,Peter Moot; Jiaxin Lin; Peter: The Discount Guru; 👬 Meet Our Team,https://www.linkedin.com/in/petermoot/; https://www.linkedin.com/in/jiaxinlin/; https://www.linkedin.com/in/petermoot/; https://www.linkedin.com/in/jiaxinlin/,; ; ; 
Ontra Mobility,https://www.ycombinator.com/companies/ontra-mobility,Summer 2024,Government,"Platform for cities to optimize transit . Founded in 2023 by Connor Riley and Anthony Trasatti, Ontra Mobility has 2 employees based in New York, NY, USA.",https://www.ontramobility.com,2023,"New York, NY, USA",Anthony Trasatti; Connor Riley,https://linkedin.com/in/anthony-trasatti; https://linkedin.com/in/connortriley,; https://twitter.com/connortriley
Aluna,https://www.ycombinator.com/companies/aluna,Summer 2024,"B2B; Engineering, Product and Design","Data for biomedical AI. Founded in 2024 by David Chu, Aluna has 3 employees based in San Francisco, CA, USA.",https://alunadata.com,2024,"San Francisco, CA, USA",David Chu; 🚩 Problem:,https://www.linkedin.com/in/dchu17/; https://www.linkedin.com/in/john-finberg,; 
Kopra Bio,https://www.ycombinator.com/companies/kopra-bio,Summer 2024,Healthcare; Therapeutics,"Genetically engineered viruses that teach your immune system to kill…. Founded in 2024 by Andrew Bartynski and Alexander Haddad, Kopra Bio has 2 employees based in San Francisco, CA, USA.",https://kopra.bio,2024,"San Francisco, CA, USA",Alexander Haddad; —,https://www.ycombinator.com/companies/www.linkedin.com/in/alexander-haddad-49b484305; https://www.linkedin.com/in/andrewbartynski/,https://x.com/AF_Haddad; 
